{
  "vendor_scores": {"V-045": 0.88, "V-046": 0.85, "V-047": 0.93, "V-100": 0.72, "V-101": 0.7, "V-102": 0.68, "V-103": 0.65},
  "rings": [
    {"ring_id": "R-1", "vendor_ids": ["V-045", "V-046", "V-047"], "link_types": ["shared_director", "shared_address"], "score": 0.91},
    {"ring_id": "R-2", "vendor_ids": ["V-100", "V-101", "V-102", "V-103"], "link_types": ["bid_rotation"], "score": 0.74}
  ],
  "paths": [
    {"from": "V-047", "to": "V-045", "nodes": ["V-047", "P-010", "V-045"], "edge_types": ["directed_by", "directed_by"]},
    {"from": "V-047", "to": "V-046", "nodes": ["V-047", "A-007", "V-046"], "edge_types": ["located_at", "located_at"]}
  ],
  "graph": {
    "nodes": [
      {"id": "V-045", "type": "vendor", "label": "Vendor V-045", "flagged": true},
      {"id": "V-046", "type": "vendor", "label": "Vendor V-046", "flagged": true},
      {"id": "V-047", "type": "vendor", "label": "Vendor V-047", "flagged": true},
      {"id": "P-010", "type": "person", "label": "Director P-010", "flagged": false},
      {"id": "A-007", "type": "address", "label": "Address A-007", "flagged": false}
    ],
    "edges": [
      {"source": "V-047", "target": "P-010", "type": "directed_by"},
      {"source": "V-045", "target": "P-010", "type": "directed_by"},
      {"source": "V-047", "target": "A-007", "type": "located_at"},
      {"source": "V-046", "target": "A-007", "type": "located_at"}
    ]
  },
  "metrics": {
    "baseline": {"pr_auc": 0.82, "precision_at_10": 0.7},
    "gnn": {"pr_auc": 0.0, "precision_at_10": 0.0},
    "gnn_status": "skipped",
    "note": "synthetic data"
  }
}
